{"$schema":"https://json-schema.org/draft/2020-12/schema","type":"object","additionalProperties":false,
 "description":"FR3 (FS1 F5, design Task 32): the per-project protected protocol file <project>/benchmarks/project/protocol/protocol.json. It carries the project's own protected data: its models, oracle file, tolerances, solver constants, planning shares, decision policies, required before_run checks, test stubs, panel models, library report and local aggregate schema. The framework names none of these values. bench.json binds the file by sha256 (bench_model.project_bench refuses an unbound or edited file); the file binds each referenced file by sha256; bench run records the digest in run.json (protocol_sha256) and decide refuses a run whose recorded digest differs from the current file. A change needs the approver (safety/protected-paths.json project_protected).",
 "required":["schema_version","cases","approval"],
 "properties":{
  "schema_version":{"const":1},
  "cases":{"type":"array","minItems":1,"maxItems":32,"uniqueItems":true,"items":{"$ref":"#/$defs/id"},
   "description":"The case ids of the project that this protocol covers; each must be a case of bench.json."},
  "approval":{"type":"object","additionalProperties":false,"required":["state","reference"],
   "description":"The approver state of this protocol. A decision policy of the protocol is filled only when the state is APPROVED.",
   "properties":{"state":{"enum":["PENDING","APPROVED"]},"reference":{"type":["string","null"],"pattern":"^[A-Za-z0-9._/-]{8,160}$"}},
   "if":{"properties":{"state":{"const":"APPROVED"}}},"then":{"properties":{"reference":{"type":"string"}}}},
  "models":{"type":"array","minItems":1,"maxItems":16,"uniqueItems":true,"items":{"$ref":"#/$defs/selector"},
   "description":"The model (selector) names of the project. The panel models, planning shares, stub selectors and library report selectors are names of this list."},
  "tolerances":{"type":"object","maxProperties":32,"propertyNames":{"$ref":"#/$defs/key"},"additionalProperties":{"$ref":"#/$defs/tolerance"},
   "description":"The project's agreement tolerances. A value that is an object with a `state` is the tolerance block of the selector of the same name: a plan or a run of that selector is refused until the state starts with `locked` (bench_model.require_locked_selectors)."},
  "solver":{"type":"object","maxProperties":32,"propertyNames":{"$ref":"#/$defs/key"},"additionalProperties":{"type":"number"},
   "description":"The project's numeric solver constants; the framework reads none of them."},
  "budgets":{"type":"object","additionalProperties":false,
   "description":"The project's planning shares per selector (Amendment I3 R14, I10.1): a selector that share_required lists needs an estimate_share_per_selector value.",
   "properties":{"estimate_share_per_selector":{"type":"object","maxProperties":16,"propertyNames":{"$ref":"#/$defs/selector"},"additionalProperties":{"type":"number","exclusiveMinimum":0,"maximum":1000}},
    "share_required":{"type":"array","maxItems":16,"uniqueItems":true,"items":{"$ref":"#/$defs/selector"}}}},
  "before_run_required":{"type":"object","maxProperties":32,"propertyNames":{"$ref":"#/$defs/id"},
   "additionalProperties":{"type":"array","minItems":1,"maxItems":32,"uniqueItems":true,"items":{"$ref":"#/$defs/id"}},
   "description":"T29-APP-01 (P15 removed-safety-check): per case id of this project, the project checks that must stay declared in bench.json with before_run true; bench validate and bench run refuse the case (FAIL) when one is missing or switched off."},
  "decision_policies":{"type":"object","maxProperties":8,
   "propertyNames":{"$ref":"#/$defs/id","not":{"enum":["owner","demo-latency-2x","demo-cpu-40"]}},
   "additionalProperties":{"$ref":"#/$defs/unit_threshold_policy"},
   "description":"The project's unit-threshold decision policies (Amendment G9.1 with I8.1 and I15.6). bench decide --policy NAME loads one by name from the protocol of the run's project. The statistical constants are pinned because tools/bench_units.py and benchlab/coverage.py decide with them."},
  "stubs":{"type":"array","maxItems":8,
   "description":"Test-only call-deadline stubs (Amendment G2.3, G2.6, I9.4): bench selftest runs one stub run and one stub check per entry. The case must declare a call deadline with the reason and the variant; the check must be a check of bench.json. The coordinator passes SAFE_C_TEST_STUB=<reason> to the trial child of the stub plan only.",
   "items":{"type":"object","additionalProperties":false,"required":["reason","check","variant"],
    "properties":{"reason":{"type":"string","pattern":"^[a-z0-9-]{1,32}$"},"check":{"$ref":"#/$defs/id"},"variant":{"$ref":"#/$defs/id"},
     "label":{"type":"string","minLength":1,"maxLength":60}}}},
  "panel":{"type":"object","additionalProperties":false,"required":["models","digest_form"],
   "description":"The single-record panel reference of the project (Amendment G3.3, I7.2, H21): the models of the panel inputs (mask = 2^n - 1 in this order) and the digest form of its reference.",
   "properties":{"models":{"type":"array","minItems":1,"maxItems":8,"uniqueItems":true,"items":{"$ref":"#/$defs/selector"}},
    "digest_form":{"type":"string","pattern":"^[a-z0-9-]{3,32}$"},
    "cell_rule":{"$ref":"#/$defs/cell_rule"}}},
  "verdict_counts":{"type":"array","maxItems":16,"uniqueItems":true,"items":{"$ref":"#/$defs/column"},
   "description":"FR5 (ruling FR5-R1 item 2): the names of the project's own verdict counts. A trial child reports them under verdict.verdict_counts (schemas/bench-observation.json); bench run refuses an observation that names another count."},
  "library_report":{"type":"object","additionalProperties":false,"required":["selectors","label"],
   "description":"Amendment G2.3: the unit records of these selectors carry the library label, the library overhead per row and the reference admit exclusions of the run.",
   "properties":{"selectors":{"type":"array","minItems":1,"maxItems":8,"uniqueItems":true,"items":{"$ref":"#/$defs/selector"}},
    "label":{"type":"string","minLength":1,"maxLength":120}}},
  "local_exceptions":{"type":"array","maxItems":16,"uniqueItems":true,"items":{"type":"string","pattern":"^[A-Z][A-Za-z0-9]{1,40}$"},
   "description":"Exception class names of the project that a local aggregate may count by name; every other class counts as Other."},
  "oracle":{"$ref":"#/$defs/file","description":"The project's oracle data file in the protocol directory, bound by sha256."},
  "aggregate_schema":{"$ref":"#/$defs/file","description":"The JSON schema of the `summary` block of a local aggregate of this project (schemas/bench-local-aggregate.json), bound by sha256."}
 },
 "$defs":{
  "column":{"type":"string","pattern":"^[a-z][a-z0-9_]{0,31}$"},
  "finite":{"type":"number","minimum":-1e300,"maximum":1e300},
  "cell_rule":{"type":"object","additionalProperties":false,"required":["category","position","scale","level_ratios","grid","report","cells"],
   "description":"FR5 (ruling FR5-R1 item 1): the panel cell rule of the project (tools/bench_panel.py): a generic banded rule over the project's named row columns. The panel inputs carry one column per name. A cell takes the candidate rows of its category value whose position lies in its band; the fallback level comes from |log(scale / scale_target)| against log(level_ratios[0]) and log(level_ratios[1]); grid holds the grid test settings; the distance is |position - position_target| + |log(scale / scale_target)|. The report entries are the values that the panel rows and the decision record show (value = column x factor). bench_model checks the cross-field rules (distinct role columns, reserved names, known category labels, increasing ratios).",
   "properties":{
    "category":{"type":"object","additionalProperties":false,"required":["column","labels"],
     "properties":{"column":{"$ref":"#/$defs/column"},
      "labels":{"type":"object","minProperties":1,"maxProperties":16,"propertyNames":{"pattern":"^[a-z][a-z0-9-]{0,15}$"},"additionalProperties":{"type":"integer","minimum":0,"maximum":255}}}},
    "position":{"$ref":"#/$defs/column"},
    "scale":{"$ref":"#/$defs/column"},
    "level_ratios":{"type":"array","minItems":2,"maxItems":2,"items":{"type":"number","exclusiveMinimum":1,"maximum":1e6}},
    "grid":{"$ref":"#/$defs/grid"},
    "report":{"type":"array","minItems":1,"maxItems":8,"items":{"type":"object","additionalProperties":false,"required":["name","column"],
     "properties":{"name":{"$ref":"#/$defs/column"},"column":{"$ref":"#/$defs/column"},"factor":{"type":"number","exclusiveMinimum":0,"maximum":1e6}}}},
    "cells":{"type":"array","minItems":6,"maxItems":6,"items":{"$ref":"#/$defs/panel_cell"}}}},
  "grid":{"type":"object","additionalProperties":false,"required":["upper","points"],
   "description":"FR5A-01 (ruling FR5-R3): the settings of the project's grid test (the per-row grid_ok of the panel inputs): a finite upper bound above 0 and an integer point count of 2 to 4096 (the framework limit, tools/bench_panel.GRID_POINTS_MAX). The framework names no value; the panel inputs and the reference carry these settings.",
   "properties":{"upper":{"type":"number","exclusiveMinimum":0,"maximum":1e6},"points":{"type":"integer","minimum":2,"maximum":4096}}},
  "panel_cell":{"type":"object","additionalProperties":false,"required":["name","category","band","position_target","scale_target"],
   "properties":{"name":{"type":"string","pattern":"^[a-z][a-z0-9-]{0,31}$"},"category":{"type":"string","pattern":"^[a-z][a-z0-9-]{0,15}$"},
    "band":{"type":"object","additionalProperties":false,"required":["op","bound"],"properties":{"op":{"enum":["gt","lt","abs_le"]},"bound":{"$ref":"#/$defs/finite"}}},
    "position_target":{"$ref":"#/$defs/finite"},"scale_target":{"type":"number","exclusiveMinimum":0,"maximum":1e300}}},
  "id":{"type":"string","pattern":"^[a-z][a-z0-9-]{2,40}$"},
  "selector":{"type":"string","pattern":"^[a-z0-9-]{1,16}$"},
  "key":{"type":"string","pattern":"^[a-z][a-z0-9_-]{0,40}$"},
  "file":{"type":"object","additionalProperties":false,"required":["file","sha256"],
   "properties":{"file":{"type":"string","pattern":"^[a-z0-9][a-z0-9._-]{0,63}\\.json$"},"sha256":{"type":"string","pattern":"^[0-9a-f]{64}$"}}},
  "tolerance":{"oneOf":[{"type":"number"},{"type":"string","maxLength":64},
   {"type":"object","maxProperties":32,"propertyNames":{"$ref":"#/$defs/key"},
    "properties":{"state":{"type":"string","pattern":"^(provisional|locked)-[a-z0-9][a-z0-9-]{0,38}$",
      "description":"FR3-02 (A6P-05, N6): provisional-<name> or locked-<name>; the bare state locked is refused."},
     "approval":{"type":"string","pattern":"^[A-Za-z0-9._/-]{8,160}$"}},
    "if":{"required":["state"],"properties":{"state":{"pattern":"^locked-"}}},"then":{"required":["approval"]},
    "additionalProperties":{"oneOf":[{"type":"number"},{"type":"string","maxLength":160},
     {"type":"object","maxProperties":32,"propertyNames":{"$ref":"#/$defs/key"},"additionalProperties":{"type":"number"}}]}}]},
  "null_limits":{"type":"object","additionalProperties":false,"required":["cpu_regression","latency_regression","memory_regression"],
   "properties":{"cpu_regression":{"type":"null"},"latency_regression":{"type":"null"},"memory_regression":{"type":"null"}}},
  "unit":{"type":"string","pattern":"^[a-z0-9-]{1,16}/(full-dataset|single-record)$"},
  "unit_threshold_policy":{"type":"object","additionalProperties":false,
   "required":["state","demonstration_only","kind","source","case","metric","verdict_mode","reported_modes","threshold_ns_per_request","units",
               "python_languages","c_languages","safe_routes","less_safe_routes","panel_statistic","primary_blocks","interval_method",
               "alpha_one_sided","multiplicity","extension_blocks","extension_trigger","extension_window","c_project_check","pool_cpu_guard","limits"],
   "properties":{"state":{"const":"approved"},
    "demonstration_only":{"const":false},
    "kind":{"const":"unit-threshold"},
    "source":{"type":"string","minLength":1,"maxLength":160},
    "case":{"$ref":"#/$defs/id"},
    "metric":{"const":"wall_ns_per_request"},
    "verdict_mode":{"const":"warm"},
    "reported_modes":{"const":["warm","cold"]},
    "threshold_ns_per_request":{"type":"integer","minimum":1,"maximum":3600000000000},
    "units":{"type":"array","minItems":1,"maxItems":10,"uniqueItems":true,"items":{"$ref":"#/$defs/unit"}},
    "python_languages":{"const":["python","python-library"]},
    "c_languages":{"const":["c"]},
    "safe_routes":{"const":["stdio","shm"]},
    "less_safe_routes":{"const":["inproc"]},
    "panel_statistic":{"const":"max"},
    "primary_blocks":{"const":12},
    "interval_method":{"const":"order-statistic"},
    "alpha_one_sided":{"const":[0.025,0.0125]},
    "multiplicity":{"const":"bonferroni"},
    "extension_blocks":{"const":12},
    "extension_trigger":{"const":"python-near-threshold"},
    "extension_window":{"const":"separate-lock-window"},
    "c_project_check":{"const":{"accept_exit":[0,3],"exit_3_requires":"local-framework-qualification-g9.4",
                                "exit_3_label":"framework qualified locally, not published"}},
    "pool_cpu_guard":{"type":"null"},
    "limits":{"$ref":"#/$defs/null_limits"}}}
 }}
