{"schema_version":1,"cases":["fixture-case"],
 "approval":{"state":"APPROVED","reference":"fixture-protocol-approval"},
 "models":["m1","m2","m3","m4","m5"],
 "tolerances":{"state":"provisional-fixture","abs":1e-9,
  "m4":{"state":"locked-fixture","approval":"fixture-tolerance-lock","abs":1e-9,"terms":{"a":0,"b":0}},
  "m5":{"state":"locked-fixture","approval":"fixture-tolerance-lock","abs":1e-9}},
 "solver":{"tolerance":1e-10,"max_iterations":200},
 "budgets":{"estimate_share_per_selector":{"m1":0.05,"m2":0.10,"m3":1.0,"m4":0.15,"m5":3.0},"share_required":["m5"]},
 "before_run_required":{"fixture-case":["fixture-oracle","fixture-agreement"]},
 "decision_policies":{"fixture-request-threshold":{"state":"approved","demonstration_only":false,"kind":"unit-threshold",
  "source":"unit-test fixture (synthetic)","case":"fixture-case","metric":"wall_ns_per_request","verdict_mode":"warm","reported_modes":["warm","cold"],
  "threshold_ns_per_request":200000000,
  "units":["m1/full-dataset","m2/full-dataset","m3/full-dataset","m4/full-dataset","m5/full-dataset",
           "m1/single-record","m2/single-record","m3/single-record","m4/single-record","m5/single-record"],
  "python_languages":["python","python-library"],"c_languages":["c"],"safe_routes":["stdio","shm"],"less_safe_routes":["inproc"],
  "panel_statistic":"max","primary_blocks":12,"interval_method":"order-statistic","alpha_one_sided":[0.025,0.0125],"multiplicity":"bonferroni",
  "extension_blocks":12,"extension_trigger":"python-near-threshold","extension_window":"separate-lock-window",
  "c_project_check":{"accept_exit":[0,3],"exit_3_requires":"local-framework-qualification-g9.4","exit_3_label":"framework qualified locally, not published"},
  "pool_cpu_guard":null,"limits":{"cpu_regression":null,"latency_regression":null,"memory_regression":null}}},
 "stubs":[{"reason":"stub-hang","check":"hang-stub","variant":"py-library","label":"hang"},
          {"reason":"stub-overrun","check":"overrun-stub","variant":"py-library","label":"overrun"}],
 "panel":{"models":["m1","m2","m3","m4","m5"],"digest_form":"fixture-v1",
  "cell_rule":{"category":{"column":"group","labels":{"g0":0,"g1":1}},"position":"p","scale":"s","level_ratios":[2.0,4.0],"grid":{"upper":2.5,"points":32},
   "report":[{"name":"r","column":"r"},{"name":"p","column":"p"},{"name":"s","column":"s"},{"name":"s_scaled","column":"s","factor":365.0}],
   "cells":[{"name":"g1-pos-near","category":"g1","band":{"op":"gt","bound":0.0},"position_target":0.09531017980432493,"scale_target":0.0821917808219178},
            {"name":"g1-pos-far","category":"g1","band":{"op":"gt","bound":0.0},"position_target":0.09531017980432493,"scale_target":1.0},
            {"name":"g0-mid-near","category":"g0","band":{"op":"abs_le","bound":0.04879016416943205},"position_target":0.0,"scale_target":0.0821917808219178},
            {"name":"g0-mid-far","category":"g0","band":{"op":"abs_le","bound":0.04879016416943205},"position_target":0.0,"scale_target":1.0},
            {"name":"g1-neg-near","category":"g1","band":{"op":"lt","bound":0.0},"position_target":-0.10536051565782628,"scale_target":0.0821917808219178},
            {"name":"g1-neg-far","category":"g1","band":{"op":"lt","bound":0.0},"position_target":-0.10536051565782628,"scale_target":1.0}]}},
 "verdict_counts":["c1","c2"],
 "library_report":{"selectors":["m4"],"label":"py-library: library side test included"},
 "local_exceptions":["FixtureError"],
 "aggregate_schema":{"file":"aggregate.schema.json","sha256":"ee7f9fa82dc1178ac8a36b21b1e49f0f460d3f20d646dc289810a8e3250d3c15"},
 "oracle":{"file":"oracle.json","sha256":"b251761e19ce8bd83925938879e8ec357e46f7c7f055e1fe48a45fd0ac44067a"}}
